category,title,creator,publication_year,description
book,Split America,Brad Schaefer,1951,Nesciunt harum tenetur nulla.
album,Major Treat,Alissa Abbott,1932,Id velit ratione rerum.
album,Blue Level,Dr. Grant Kub,1932,Dicta quam est voluptate.
album,Melty America,Raul Hammes PhD,2009,Fugiat repellat eos sint.
album,Holiday Look,September Veum,1942,Dolorem omnis animi eos.
book,Thanksgiving Choice,Serena Ruecker,1928,Sequi voluptas rem vel.
album,Green Forrester,Mrs. Carson Sawayn,1939,Ut optio non fuga.
album,Red Forrester,Millard Beatty,1927,Aut magnam et repellat.
movie,Brooklyn Cake,Ira Kling,1977,Alias et nesciunt quo.
book,Major Solstice,Reuben Upton,1935,Impedit laboriosam repellat sint.
movie,Street Coffee,Flossie Schultz,1969,Magnam rem ad cum.
movie,Bluebery Solstice,Philip Homenick I,2019,Reiciendis sit impedit asperiores.
album,Kreb-Full-o Extract,Ms. Claudette Turner,1998,Dicta nam adipisci voluptatibus.
album,Blacktop Star,Milton Zieme,1976,Quas eligendi dolores voluptatem.
movie,Seattle Bean,Ms. Josh Satterfield,2001,Architecto officia sapiente molestias.
album,Blue Volcano,Danille Gerhold IV,1943,Commodi quaerat omnis voluptas.
book,Melty Select,Chia Gerlach,1924,At quia exercitationem vitae.
album,KrebStar Forrester,Eddy Walsh MD,1960,Dolores praesentium earum minima.
book,Chocolate Cowboy,Dr. Erlene Zemlak,1972,Numquam voluptatibus magnam ut.
album,Brooklyn Volcano,Chris Leuschke,1919,Et consectetur non et.
book,Huggy Volcano,Karri Weimann,1930,Consequuntur aut sint et.
book,Veranda Equinox,Arnoldo Lindgren DVM,1965,Atque ut ut sapiente.
movie,Dark Select,Dr. Bobbie Larkin,2000,Recusandae id ut veritatis.
book,Pumpkin-spice Pie,Devin Murazik PhD,1955,Non omnis aut autem.
movie,KrebStar Choice,Brady Jacobs,1989,Quis sunt sed non.
album,Wake-up Volcano,Elinore McDermott,1920,Id ipsam iusto quia.
movie,American Breaker,Mr. Cecile Watsica,2012,Et quaerat est laboriosam.
book,Jacked Level,Ashlea Russel,1990,Sit voluptatibus quis rerum.
movie,Hello Blend,Gennie Collins I,1926,Facilis voluptas non et.
album,Wake-up Breaker,Cindie Anderson,1939,Velit dicta quia dignissimos.
movie,Blacktop Volcano,Brady Johnston,1965,Maxime eaque fugit voluptas.
book,Wake-up Town,Leila Klocko DVM,2004,Minima magnam nesciunt voluptatem.
book,Evening ,Fermin Hettinger MD,1926,Architecto ad quia saepe.
album,Red Extract,Miss Steve Schaden,1975,Est repellendus eum ab.
book,Green Look,Terrell Ratke,1954,Sequi molestias tempora doloribus.
movie,Melty America,Jake Brown,1921,Tempore accusamus blanditiis incidunt.
album,Pumpkin-spice Treat,Irma Daniel,1937,Quia sit est voluptas.
book,Captain's Light,Elden Dooley,1983,Ut quis fugit nam.
album,Winter Solstice,Mrs. Claude Stroman,1922,Minima tempora adipisci quibusdam.
book,Holiday Treat,Coy Prosacco,2009,Animi dolores et provident.
movie,Strong Enlightenment,Lizzie Jaskolski Jr.,1922,Qui eum minima hic.
movie,Seattle Delight,Orlando Franecki,1933,Dignissimos aliquid ducimus rem.
movie,Jacked Select,Mr. Ezequiel Boyer,2015,Distinctio voluptate quia dicta.
book,Joe Bean,Mr. Hyman Dicki,1942,Fugit quis optio voluptas.
book,Split Treat,Kristina Kulas,1926,Culpa et esse provident.
book,Split Level,Mr. Earle Maggio,2000,Ut accusamus fuga voluptates.
album,Spilt Breaker,Miss Cameron Kuvalis,1990,Velit accusantium autem voluptate.
album,Winter Forrester,January Rempel IV,1983,Libero doloremque ut veritatis.
movie,Hello Level,Loria Hudson,2005,Quam rerum laborum provident.
book,Cascara Utopia,Miss Andres Welch,1995,Quia quas in et.
