category,title,creator,publication_year,description
album,Digital Slide Switch,Dark Storm X,1936,Re-engineered modular intranetrecontextualize turn-key communities
book,Digital Piezoelectric device,Red Darkside Strange,1984,Vision-oriented mission-critical softwaremesh dot-com solutions
book,1080p Printed Circuit Board,Supah Ares Lord,1954,Vision-oriented stable neural-netincentivize B2B architectures
book,Redundant crystal,The Spider,2003,Assimilated value-added workforcetarget real-time synergies
movie,Multi-byte Power Cord,Feral of Hearts,2009,Stand-alone mission-critical functionalitiesrepurpose next-generation partnerships
book,Solid state Keypad,Kang III,1928,Polarised composite encodinginnovate customized functionalities
book,Cross-platform DIP Switch,Supah Two-Face,2002,Visionary actuating algorithmsynthesize efficient action-items
book,Cross-platform Power Cord,Ben Girl,1919,Re-contextualized full-range productgenerate transparent bandwidth
book,Primary Socket,Cyborg Nova,2008,Future-proofed actuating help-deskvisualize granular systems
album,Neural Printed Circuit Board,Walrus IX,1981,Future-proofed dedicated pricing structurescale cross-platform niches
book,Redundant crystal,Vindicator Brain,1950,Multi-channelled discrete productivitydeploy holistic ROI
album,1080p Slide Switch,Magnificent Darkhawk,1984,Progressive actuating hardwareaggregate cross-platform supply-chains
album,Cross-platform Circuit Breaker,Mr Skaar,2001,Object-based multimedia moratoriumevolve B2B architectures
album,Back-end DIP Switch,The Spawn,1960,Exclusive multi-tasking hierarchyevolve bricks-and-clicks interfaces
album,Haptic crystal,Booster Gold,1933,Up-sized full-range implementationintegrate value-added technologies
movie,Open-source Terminal,Sunspot,1925,Pre-emptive fresh-thinking orchestrationrevolutionize B2C methodologies
movie,Online DIP Switch,Mr Trickster,2011,Enhanced non-volatile hardwarescale value-added users
album,Multi-byte Ultrasonic Motor,Maverick,2002,Proactive coherent secured linerecontextualize dot-com networks
album,Solid state Toggle Switch,Agent Blizzard,1935,Robust encompassing process improvementstrategize turn-key metrics
book,Solid state DIP Switch,ERG Spirit,1958,Optional multi-tasking info-mediariesstreamline value-added paradigms
book,Digital Toggle Switch,Supah Morph,1996,Phased content-based softwarestrategize sticky partnerships
book,Neural DIP Switch,Hollow,1925,Seamless context-sensitive instruction setsyndicate front-end web services
album,Optical Slide Switch,Doctor Violet,1961,Ameliorated explicit collaborationbenchmark out-of-the-box paradigms
movie,Redundant Fuse,Arclight III,1935,Versatile hybrid knowledge basebenchmark efficient infomediaries
book,Solid state Ultrasonic Motor,Banshee,1977,Focused national benchmarkengage one-to-one e-business
book,Open-source Circuit Breaker,Doctor Hawk,1999,Stand-alone 24/7 capabilityrevolutionize killer content
movie,Optical Piezoelectric device,Mr Quantum IX,1998,Re-engineered multi-tasking projectiondrive synergistic eyeballs
book,Online Toggle Switch,Doctor Ghost,1924,Re-contextualized impactful budgetary managementfacilitate innovative e-markets
movie,1080p Fuse,The Ink,1986,Visionary hybrid interfacedeploy vertical methodologies
book,Auxiliary Keypad,Doc Samson Man,1940,Switchable solution-oriented capacityrevolutionize transparent users
album,Solid state Socket,Ultra Goblin Queen,1929,Optimized impactful firmwareaggregate transparent mindshare
album,1080p Power Cord,Redeemer,1985,Streamlined real-time internet solutionunleash robust ROI
movie,Multi-byte Slide Switch,Giant Booster Gold Eyes,1920,Extended clear-thinking orchestrationgrow 24/365 systems
album,Optical Slide Switch,Aztar the Hunter,1935,Compatible even-keeled moratoriumrecontextualize customized systems
movie,Wireless Power Cord,The Nathan Petrelli Girl,1985,Virtual directional accessrepurpose value-added networks
book,Digital Ultrasonic Motor,Green Lyja Brain,2008,Expanded impactful superstructureexploit turn-key synergies
album,Solid state Ultrasonic Motor,Warbird,1987,Persistent user-facing Graphic Interfacemesh robust architectures
movie,Mobile Printed Circuit Board,Bushido Claw,1921,Seamless leading edge functiondrive dynamic e-markets
book,Multi-byte Socket,Agent Colin Wagner Brain,2010,Diverse object-oriented firmwareengage extensible e-business
movie,Multi-byte Power Cord,Red Metron,2004,Seamless zero tolerance projectionstreamline scalable web-readiness
movie,Wireless Footswitch,Agent Chromos,1980,Adaptive national hubbrand interactive e-tailers
movie,Solid state Power Cord,Agent Toad Girl,1984,Managed needs-based attitudereinvent strategic models
movie,Cross-platform Fuse,Venom XI,2014,Compatible didactic archivematrix visionary deliverables
album,Virtual crystal,Doctor Yellowjacket,1975,Grass-roots tangible approachfacilitate cutting-edge metrics
movie,Virtual Circuit Breaker,Cyborg Jolt XI,1981,Advanced systemic coremaximize virtual technologies
album,Auxiliary Toggle Switch,Captain Venom Ivy,1996,Versatile fault-tolerant task-forceengineer B2C supply-chains
album,Neural Toggle Switch,Atom Girl,1937,Re-engineered 3rd generation utilisationenable best-of-breed web services
book,Digital crystal,Cyborg Winter Soldier,1966,Face to face solution-oriented budgetary managementorchestrate out-of-the-box ROI
album,Neural Piezoelectric device,Proto-Goblin,1941,User-centric analyzing task-forcescale impactful initiatives
book,Digital Ultrasonic Motor,General Shrinking Violet,1965,Realigned asynchronous projectscale frictionless e-markets
album,Digital Fuse,Doctor Zoom Strike,1981,Profound optimal knowledge basesyndicate interactive infrastructures
movie,Digital Circuit Breaker,Punisher II,1998,Virtual encompassing infrastructuremorph out-of-the-box bandwidth
album,Bluetooth Piezoelectric device,Toxin,1953,Implemented stable pricing structurematrix leading-edge e-commerce
movie,Online Toggle Switch,Yellow,2007,Compatible fresh-thinking policygenerate viral partnerships
book,1080p crystal,Illustrious Jack-Jack,1925,Digitized tertiary projectvisualize innovative deliverables
book,1080p Fuse,Blink,1932,Synergized fault-tolerant coreincubate out-of-the-box functionalities
book,Cross-platform Socket,Agent Rogue Girl,1946,User-friendly secondary leveragedisintermediate impactful infomediaries
album,Haptic Piezoelectric device,Evilhawk,1946,Triple-buffered client-server accesstransform open-source functionalities
movie,Multi-byte Fuse,Venom,2006,Stand-alone neutral task-forcemorph 24/365 infrastructures
book,Optical Socket,Hyperion,1998,Decentralized systematic intranetextend world-class methodologies
book,Optical Toggle Switch,Magnificent Tiger Shark I,1967,Virtual attitude-oriented help-deskoptimize frictionless bandwidth
movie,Wireless Fuse,Cyborg Cy-Gor,1989,Versatile motivating moratoriumdisintermediate B2C systems
book,Back-end Power Cord,Rocket Raccoon,1943,Open-source client-server firmwarewhiteboard enterprise paradigms
book,Digital Keypad,Molten Man II,1998,Reactive multimedia open systemengineer holistic platforms
album,Mobile Footswitch,Dark Garbage Claw,1939,Devolved national knowledge userreinvent e-business users
movie,1080p Slide Switch,Evilhawk,1960,Upgradable explicit intranetengineer plug-and-play initiatives
album,Cross-platform DIP Switch,Agent Carnage Claw,1949,Optional grid-enabled definitionmatrix seamless functionalities
movie,Optical Footswitch,Cyborg Gog,1940,User-friendly client-server complexityimplement bricks-and-clicks e-commerce
album,Optical Toggle Switch,Evilhawk,1968,Organized motivating attitudeimplement innovative web services
movie,Online Socket,Shocker,2019,Monitored systematic forecastenvisioneer user-centric markets
movie,Neural Piezoelectric device,General Wildfire Machine,1929,Managed tertiary standardizationexpedite web-enabled partnerships
movie,Open-source Keypad,Supah Brother Voodoo,1990,Multi-layered multimedia forecastembrace web-enabled interfaces
album,Multi-byte Keypad,Red Thing,1968,Virtual real-time structuremaximize efficient interfaces
album,Mobile Slide Switch,Ultra Warlock,1929,Operative contextually-based matrixmaximize sticky models
movie,Back-end DIP Switch,Plastique,2001,Horizontal 24/7 groupwaresyndicate mission-critical web-readiness
album,Solid state Circuit Breaker,Giant Evilhawk XI,1987,Automated optimizing artificial intelligenceengage virtual synergies
book,Mobile Slide Switch,Supah Doomsday,2013,Vision-oriented composite throughputbrand B2B vortals
book,Solid state DIP Switch,Cyborg Ghost Wolf,1941,Public-key bifurcated approachutilize proactive convergence
book,Primary Keypad,Dark Deathstroke,1969,Implemented needs-based moratoriumengineer leading-edge deliverables
book,Haptic Power Cord,Giganta I,1958,Open-source encompassing neural-netcultivate user-centric applications
album,Redundant Printed Circuit Board,Apocalypse I,1991,Upgradable multimedia system engineembrace proactive metrics
album,Cross-platform Terminal,Quill,1989,Monitored national encodingproductize cross-platform web services
album,Solid state Ultrasonic Motor,Loki,1991,Customer-focused tangible time-frameharness customized users
movie,Optical Power Cord,Cyborg Shrinking Violet Knight,1959,Networked systematic framecultivate B2B e-commerce
movie,Digital Printed Circuit Board,Longshot Strike,1939,Quality-focused background internet solutionmorph strategic paradigms
movie,Wireless Fuse,Captain Hybrid,2015,De-engineered global knowledge useriterate end-to-end e-markets
movie,Virtual Socket,Vindicator II,1993,Grass-roots tangible challengesynergize global initiatives
movie,Neural Terminal,Mr Hercules,1920,Exclusive user-facing functiondisintermediate integrated architectures
book,Online DIP Switch,Corsair,1940,Networked logistical internet solutionrevolutionize compelling architectures
book,Primary crystal,Corsair,1967,User-friendly maximized circuitbenchmark leading-edge synergies
movie,Virtual Footswitch,Green Carnage the Fated,1944,Optimized directional Graphic Interfacedisintermediate cutting-edge ROI
movie,1080p Terminal,Cyborg Yellow Machine,1974,Realigned regional encryptionengage turn-key platforms
book,Wireless Socket,Moonstone,1944,Public-key heuristic task-forcescale interactive bandwidth
album,Optical Fuse,Ultra Deadpool Ivy,1996,Integrated logistical portaltransition ubiquitous relationships
movie,Solid state Slide Switch,Mr Mockingbird II,1960,Total client-server solutionempower enterprise relationships
book,Neural crystal,Question,2009,Self-enabling explicit hierarchyexploit frictionless experiences
album,Cross-platform Terminal,Giant Wolverine,2002,Ergonomic bi-directional conceptharness magnetic mindshare
album,Virtual Ultrasonic Motor,Firebird,1999,Team-oriented asynchronous process improvementstrategize wireless schemas
book,Mobile DIP Switch,Cypher Brain,2002,Decentralized 4th generation analyzerarchitect e-business schemas
book,Neural Power Cord,Snowbird Dragon,2017,Reactive static capabilityrecontextualize visionary mindshare
